<?xml version="1.0" encoding="UTF-8"?>


<c:Companies
    xmlns:xsi='http://www.w3.org/2001/XMLSchema-instance'
    xmlns:c='http://www.CompanyInfo.se'
    xsi:schemaLocation='http://www.CompanyInfo.se ../xsd/CompanyInfoSchema.xsd'>
        <c:Company>
		<c:Name> MIT </c:Name>
                <c:CompanyNumber>101010</c:CompanyNumber>
                <c:PhoneNumber>25194327834</c:PhoneNumber>
	</c:Company>
	<c:Company>
		<c:Name>MIT Mu</c:Name>
                <c:CompanyNumber>101010</c:CompanyNumber>
                <c:PhoneNumber>25194327834</c:PhoneNumber>
	</c:Company>
</c:Companies>
